{
  "application_provenance": {
    "git_commit": "e9c946d92cb27fbbeef878121ab12af2c8a469fd",
    "name": "BatLLM",
    "trace_schema_version": 3,
    "version": "0.3.6"
  },
  "created_at": "2026-01-01T00:00:00+00:00",
  "games": [
    {
      "final_state": {
        "1": {
          "current_prompt": "",
          "health": 30,
          "id": 1,
          "last_llm_response": null,
          "rot": 345.0,
          "shield": true,
          "x": 0.3115925826289068,
          "y": 0.5
        },
        "2": {
          "current_prompt": "",
          "health": 30,
          "id": 2,
          "last_llm_response": null,
          "rot": 165.0,
          "shield": false,
          "x": 0.6934024384963247,
          "y": 0.5379409522551261
        }
      },
      "game_id": 1,
      "rounds": [
        {
          "ended_at": "2026-01-01T00:00:00+00:00",
          "final_state": {
            "1": {
              "current_prompt": "",
              "health": 30,
              "id": 1,
              "last_llm_response": null,
              "rot": 345.0,
              "shield": true,
              "x": 0.3115925826289068,
              "y": 0.5
            },
            "2": {
              "current_prompt": "",
              "health": 30,
              "id": 2,
              "last_llm_response": null,
              "rot": 165.0,
              "shield": false,
              "x": 0.6934024384963247,
              "y": 0.5379409522551261
            }
          },
          "gameplay_settings_snapshot": {
            "bot_diameter": 0.1,
            "bot_step_length": 0.05,
            "bullet_damage": 5,
            "bullet_diameter": 0.02,
            "bullet_step_length": 0.01,
            "initial_health": 30,
            "shield_initial_state": false,
            "shield_size": 70.0,
            "total_rounds": 1,
            "turns_per_round": 18
          },
          "initial_state": {
            "1": {
              "current_prompt": "",
              "health": 30,
              "id": 1,
              "last_llm_response": null,
              "rot": 0.0,
              "shield": false,
              "x": 0.21500000000000002,
              "y": 0.5
            },
            "2": {
              "current_prompt": "",
              "health": 30,
              "id": 2,
              "last_llm_response": null,
              "rot": 180.0,
              "shield": false,
              "x": 0.785,
              "y": 0.5
            }
          },
          "plays": [
            {
              "attempts": 1,
              "bot_id": 1,
              "chain_sha256": "a27d122324fa98e11ea09fa3173a203e931a01919711f02a494dd23fc2f9a042",
              "context_policy": {
                "independent_contexts": true,
                "prompt_augmentation": true
              },
              "events": [
                {
                  "bot_id": 1,
                  "details": {
                    "from": 0.0,
                    "to": 15.0
                  },
                  "label": "Rotate clockwise to 15.0d",
                  "target_bot_id": null,
                  "type": "rotate"
                }
              ],
              "game_state_supplied_to_model": {
                "bots": {
                  "1": {
                    "current_prompt": "",
                    "health": 30,
                    "id": 1,
                    "last_llm_response": null,
                    "rot": 0.0,
                    "shield": false,
                    "x": 0.21500000000000002,
                    "y": 0.5
                  },
                  "2": {
                    "current_prompt": "",
                    "health": 30,
                    "id": 2,
                    "last_llm_response": null,
                    "rot": 180.0,
                    "shield": false,
                    "x": 0.785,
                    "y": 0.5
                  }
                }
              },
              "human_prompt": {
                "encoding": "utf-8",
                "length": 16,
                "sha256": "c70c015c87850ce325736da2bda03466edf7cb120c60b572f391096a3a4a6030"
              },
              "latency_ms": 0.0,
              "normalized_command": "C15.0",
              "play_id": "play_047_001",
              "play_sha256": "af9d0f1767a4b338a4b4805c97d79cae3a5b9d0285ed4662399a93e85b8414e5",
              "post_state": {
                "1": {
                  "current_prompt": "",
                  "health": 30,
                  "id": 1,
                  "last_llm_response": null,
                  "rot": 15.0,
                  "shield": false,
                  "x": 0.21500000000000002,
                  "y": 0.5
                },
                "2": {
                  "current_prompt": "",
                  "health": 30,
                  "id": 2,
                  "last_llm_response": null,
                  "rot": 180.0,
                  "shield": false,
                  "x": 0.785,
                  "y": 0.5
                }
              },
              "pre_state": {
                "1": {
                  "current_prompt": "",
                  "health": 30,
                  "id": 1,
                  "last_llm_response": null,
                  "rot": 0.0,
                  "shield": false,
                  "x": 0.21500000000000002,
                  "y": 0.5
                },
                "2": {
                  "current_prompt": "",
                  "health": 30,
                  "id": 2,
                  "last_llm_response": null,
                  "rot": 180.0,
                  "shield": false,
                  "x": 0.785,
                  "y": 0.5
                }
              },
              "previous_play_sha256": null,
              "request": {
                "canonical_sha256": "15910ed358d45e100ebb803ab5c14be30208ec0e88ea324f35e81ec13f5ed181",
                "privacy_mode": "hashed"
              },
              "request_completed_at": "2026-01-01T00:00:00+00:00",
              "request_started_at": "2026-01-01T00:00:00+00:00",
              "response": {
                "encoding": "utf-8",
                "length": 3,
                "sha256": "c1f5e527f9d411dfe793aebe1021a0910fccbc69e55cb8ddaef79f5d535d60ec"
              },
              "sequence": 1,
              "status": "ok",
              "system_instructions": {
                "encoding": "utf-8",
                "length": 51,
                "sha256": "359db889c1ef149e2557edc5238a741ce24425af2552e5d36401781509656310"
              },
              "transition_sha256": "5ebbddccc08047228224b4900dd67ce8174adbcb98c8f01015c4e458b920ab8c"
            },
            {
              "attempts": 1,
              "bot_id": 2,
              "chain_sha256": "e55a3d077c176b4e3043a288c88e0ff86e1881fd93da5390d3b5987690570edb",
              "context_policy": {
                "independent_contexts": true,
                "prompt_augmentation": true
              },
              "events": [
                {
                  "bot_id": 2,
                  "details": {
                    "from": 180.0,
                    "to": 150.0
                  },
                  "label": "Rotate counterclockwise to 150.0d",
                  "target_bot_id": null,
                  "type": "rotate"
                }
              ],
              "game_state_supplied_to_model": {
                "bots": {
                  "1": {
                    "current_prompt": "",
                    "health": 30,
                    "id": 1,
                    "last_llm_response": null,
                    "rot": 15.0,
                    "shield": false,
                    "x": 0.21500000000000002,
                    "y": 0.5
                  },
                  "2": {
                    "current_prompt": "",
                    "health": 30,
                    "id": 2,
                    "last_llm_response": null,
                    "rot": 180.0,
                    "shield": false,
                    "x": 0.785,
                    "y": 0.5
                  }
                }
              },
              "human_prompt": {
                "encoding": "utf-8",
                "length": 17,
                "sha256": "a50cfed672beb4bb909e3620981d82f794bb662904c255d6e532fdae5f705a0c"
              },
              "latency_ms": 0.0,
              "normalized_command": "A30.0",
              "play_id": "play_047_002",
              "play_sha256": "1e8ad33d19e545d88d8c529fd55c1e4c33509848183d85465fb41735b4aa02b3",
              "post_state": {
                "1": {
                  "current_prompt": "",
                  "health": 30,
                  "id": 1,
                  "last_llm_response": null,
                  "rot": 15.0,
                  "shield": false,
                  "x": 0.21500000000000002,
                  "y": 0.5
                },
                "2": {
                  "current_prompt": "",
                  "health": 30,
                  "id": 2,
                  "last_llm_response": null,
                  "rot": 150.0,
                  "shield": false,
                  "x": 0.785,
                  "y": 0.5
                }
              },
              "pre_state": {
                "1": {
                  "current_prompt": "",
                  "health": 30,
                  "id": 1,
                  "last_llm_response": null,
                  "rot": 15.0,
                  "shield": false,
                  "x": 0.21500000000000002,
                  "y": 0.5
                },
                "2": {
                  "current_prompt": "",
                  "health": 30,
                  "id": 2,
                  "last_llm_response": null,
                  "rot": 180.0,
                  "shield": false,
                  "x": 0.785,
                  "y": 0.5
                }
              },